{
  "schemaVersion": 1,
  "channel": "yino",
  "callId": "3fa85f64-5717-4562-b3fc-2c963f66afa6",
  "eventId": "aaaaaaaaaaaaaaaaaaaaaaaaaaaaaaaaaaaaaaaaaaaaaaaaaaaaaaaaaaaaaaaa",
  "startedAt": "2026-08-31T10:00:00.000Z",
  "endedAt": "2026-08-31T10:04:12.000Z",
  "durationSeconds": 252,
  "transcript": "user: hello\nassistant: hi",
  "summary": "",
  "recordingUrl": null
}